sno,complaint,complaint_description,complaint_type,recieved_date,incident_date,county,incident_closed_date,incident_status_desc,incident_zip
173,222005,Dust from concrete grinding,['Fugitive Dust/Particulate Matter'],2024-01-17,,Baltimore,2024-01-29,Incident Closed-Managed,21227
174,222004,Bumper touch up creating fumes.,['Fumes'],2024-01-18,,Baltimore,2024-01-24,Incident Closed-Managed,21228
175,222002,Smoke from wood burning stove in a barn.  Chemical odor.  Complaint of burning  treated pallets.  Complainant called the Fire Department in the past due to possibly burning plastics and rubber.  Property search states parcel of land is 17 and a half acres.,['Air'],2024-01-23,2024-01-23,Frederick,2024-02-07,Incident Closed-No Violation Observed,21703
176,221998,Concerned with CO levels in home and mold in the air conditioning unit.,['Air'],2024-01-12,2024-01-12,Montgomery,2024-01-22,Incident Closed - No further action,20904
177,221996,Concern of generator vibration.,['Other'],2024-01-18,2024-01-18,Prince George's,2024-01-22,Incident Closed-Managed,20747
178,211996,Extremely bad odor coming from West Coast Mushrooms.,"['Air', 'Odor']",2024-01-17,2024-01-17,Cecil,,Referred to LMA,21911
179,211992,Concern of Lead and smoke in Apartment,['Other'],2024-01-17,2024-01-17,Prince George's,2024-01-17,Incident Closed-Managed,
180,211985,Concerns regarding DAF facility,['Other'],2024-01-11,2024-01-11,Caroline,,Referred to Outside Agency,21660
181,211984,Failing town wastewater plant and septic system,['Other'],2024-01-10,2024-01-10,Caroline,,Referred to WMA,21660
182,211983,Odor Complaint,['Odor'],2024-01-08,2024-01-08,Baltimore City,2024-01-08,Incident Closed - No further action,
183,211973,Concern of burnt tar or coffee type odor,['Other'],2024-01-11,2024-01-11,Prince George's,2024-01-12,Incident Closed-Managed,
184,211968,Home VOC Concerns,['Other'],2024-01-04,2024-01-04,Washington,2024-01-10,Incident Closed - No further action,
185,211967,Smoke and Odors,['Smoke'],2023-12-27,2023-12-27,Allegany,2024-02-15,Incident Closed - No further action,21502
186,211964,Odor entering home at night during the past few nights,"['Air', 'Odor']",2024-01-02,2024-01-02,Cecil,2024-01-09,Incident Closed - No further action,
187,211963,Open burning,['Open Burning'],2024-01-03,2024-01-03,Wicomico,2024-01-04,Incident Closed-No Violation Observed,21804
188,211961,Odor from marijuana farm on Aylesbury.,['Odor'],2024-01-06,,Baltimore,2024-01-09,Incident Closed-Managed,
189,211960,Dust from sand blasting commercial vehicles.  Complainant submitted two pictures.,['Air'],2024-01-09,2024-01-08,Frederick,,Referred to Attorney General's Office,
190,211959,Odor inside house.  Roof leaking and water damage.,['Air'],2024-01-05,2024-01-05,Anne Arundel,2024-01-09,Incident Closed-No Violation Observed,
191,211956,Concern of odor in area.,['Other'],2024-01-05,2024-01-05,Prince George's,2024-01-17,Incident Closed-Managed,
192,211955,Concern of odor in the area,['Other'],2024-01-03,2024-01-03,Prince George's,2024-01-17,Incident Closed-Managed,
193,211949,Odor in apartment,['Odor'],2024-01-03,,Baltimore,,Incident Not Applicable to MDE,
194,211948,Odor coming from possible landfill.,['Odor'],2024-01-03,,Baltimore,2024-01-04,Incident Closed-Managed,
195,211947,Fumes from burning plastic.,['Fumes'],2024-01-03,,Baltimore,2024-01-04,Incident Closed - No further action,21222
196,211938,Concern toxic smell in apartment,['Other'],2023-12-22,2023-12-22,Howard,2024-01-03,Incident Closed-Managed,
197,211934,smoke from neighbor's firepit,['Air'],2024-01-02,2024-01-02,Anne Arundel,2024-01-03,Incident Closed-No Violation Observed,21061
198,211932,Odor complaint,['Air'],2023-12-27,2023-12-27,Anne Arundel,2023-12-28,Incident Closed-Managed,
199,211930,Odors,['Odor'],2023-12-27,,Baltimore,2024-01-09,Incident Closed-Managed,
200,211926,"EPA email stated ""Painting vehicles under the table illegally.""",['Air'],2023-12-22,2023-12-22,Frederick,2024-01-03,Incident Closed-No Violation Observed,21788
201,211907,"Burning chemicals, strong hazardous odor.",['Air'],2023-12-21,2023-12-21,Anne Arundel,2024-01-08,Incident Closed-No Violation Observed,21403
202,201907,"""Mold is present inside home. Looking for help.""",['Air'],2023-12-20,2023-12-20,Queen Anne's,2023-12-21,Incident Closed-Managed,21638
203,201905,Roadway Dust from Coal Trucks,['Fugitive Dust/Particulate Matter'],2023-12-20,2023-12-20,Allegany,,Under Investigation,21536
204,201904,Spoiled seafood odor in the area.,['Air'],2023-12-15,2023-12-15,Anne Arundel,2023-12-21,Incident Closed-No Violation Observed,21054
205,201899,Concern at the complainant's town home,['Other'],2023-12-18,2023-12-18,Prince George's,2023-12-20,Incident Closed-Managed,
206,201898,The bus terminal next door is expanding and complainant wishes to know regs involved.,['Other'],2023-12-19,,Baltimore,2023-12-20,Incident Closed - No further action,
207,201894,Odors coming from biochar process,['Odor'],2023-12-18,,Harford,2023-12-21,Incident Closed-Managed,21001
208,201889,Plane is spraying unknown substance.,['Fumes'],2023-12-13,,Baltimore,,Referred to Outside Agency,
209,201885,Obnoxious odor in Cheverly,['Other'],2023-12-15,2023-12-15,Prince George's,2023-12-18,Incident Closed-Managed,
210,201883,Concern of Indoor air quality,['Other'],2023-12-14,2023-12-14,Howard,2023-12-18,Incident Closed-Managed,
211,201873,He smells an industrial odor in the residential neighborhood.,['Odor'],2023-12-10,2023-12-10,Baltimore City,2023-12-14,Incident Closed-Managed,
212,201872,He smells an industrial odor in the residential neighborhood.,['Odor'],2023-12-08,2023-12-08,Baltimore City,2023-12-14,Incident Closed-Managed,
213,201871,He observed smoke coming from a stack at Mechanic Shop.,['Smoke'],2023-12-07,2023-12-07,Baltimore City,2023-12-14,Incident Closed-Managed,
214,201869,Sewer odors from facility detected in the nearby neighborhoods.,['Air'],2023-12-08,2023-12-08,Anne Arundel,,Referred to WMA,21403
215,201868,West Coast Mushroom Farm in Rising Sun is creating severe noxious odors due to composting activity,"['Air', 'Odor']",2023-12-13,2023-12-13,Cecil,,Referred to LMA,21911
216,201867,West Coast Mushroom Farm in Rising Sun is creating severe noxious odors due to composting activity.,"['Air', 'Odor']",2023-12-12,2023-12-12,Cecil,,Referred to LMA,21911
217,201866,Dust from sandblasting & overspray from spray painting commercial vehicles.,['Air'],2023-12-11,2023-12-11,Frederick,,Referred to Attorney General's Office,21757
218,201865,concern of loud noise in the Cheverly area,['Other'],2023-12-11,2023-12-11,Prince George's,2023-12-13,Incident Closed-Managed,
219,201864,concern of loud noise in the Cheverly area,['Other'],2023-12-11,2023-12-11,Prince George's,2023-12-13,Incident Closed-Managed,
220,201863,concern of loud noise in the Cheverly area,['Other'],2023-12-11,2023-12-11,Prince George's,2023-12-13,Incident Closed-Managed,
221,201862,concern of loud noise in the Cheverly area,['Other'],2023-12-11,2023-12-11,Prince George's,2023-12-13,Incident Closed-Managed,
222,201861,concern of loud noise in the Cheverly area,['Other'],2023-12-11,2023-12-11,Prince George's,2023-12-13,Incident Closed-Managed,
223,201860,concern of loud noise in the Cheverly area,['Other'],2023-12-11,2023-12-11,Prince George's,2023-12-13,Incident Closed-Managed,
224,201859,concern of loud noise in the Cheverly area,['Other'],2023-12-11,2023-12-11,Prince George's,2023-12-13,Incident Closed-Managed,
225,201858,concern of loud noise in the Cheverly area,['Other'],2023-12-11,2023-12-11,Prince George's,2023-12-13,Incident Closed-Managed,
226,201857,Loud boom noise in the Cheverly area,['Other'],2023-12-11,2023-12-11,Prince George's,2023-12-13,Incident Closed-Managed,
227,201856,Gas leak in multiple unit a development,['Other'],2023-12-08,2023-12-08,Prince George's,2023-12-20,Incident Closed-Managed,
228,201855,Smoke form Wood Stove,['Smoke'],2023-12-06,2023-12-06,Garrett,2024-02-09,Incident Closed - No further action,21520
229,201852,Agricultural Open Burning,['Open Burning'],2023-12-05,2023-12-05,Washington,2023-12-12,Incident Closed - No further action,21756
230,201845,Neighbor routinely burns plastic.,"['Air', 'Odor', 'Open Burning']",2023-12-11,2023-12-03,Montgomery,,Referred to Outside Agency,20902
231,201843,"Toxic, waste, carnage odor.  Surface mining activity.  Biosolids application in for this area.",['Air'],2023-12-11,2023-12-08,Charles,,Under Investigation,
232,201842,Sewer odor from the Annapolis Water Reclamation facility located on Edgewood RD,['Air'],2023-12-05,2023-12-05,Anne Arundel,,Referred to WMA,21403
233,201841,Waste odor.  Biosolid application in for this area.  Chaney Surface mining land.,['Air'],2023-12-11,2023-12-07,Charles,,Under Investigation,
234,201831,Complainant states smoke from burning tires at the Capitol Raceway facility.,['Air'],2023-12-07,2023-12-07,Anne Arundel,2023-12-07,Incident Closed - No further action,
235,201830,Smoke from burning construction debris at residential yard.  Bringing materials onto property.,['Air'],2023-12-04,2023-12-04,Frederick,2023-12-11,Incident Closed-Managed,21788
236,201829,"Toxic, dead carnage, waste or N gas odors.  Complainant contacted the CCHD first.",['Air'],2023-12-07,2023-12-06,Charles,,Under Investigation,
237,201828,RIA Home Improvements creating dust from grinding a concrete garage floor in a duplex neighborhood.  Dust travelling to neighbors yards.,['Air'],2023-12-04,2023-12-04,Frederick,2023-12-11,Incident Closed-No Violation Observed,21701
238,201827,Dust from sand blasting vehicles,['Air'],2023-12-04,2023-12-04,Frederick,,Referred to Attorney General's Office,21757
239,201825,Neighbors open burning,['Open Burning'],2023-12-01,2023-12-01,Wicomico,,Under Investigation,21801
240,201823,Smoke from neighbor's outdoor boiler.,['Smoke'],2023-12-04,,Baltimore,2023-12-05,Incident Closed - No further action,
241,201822,He smells an industrial odor in the residential neighborhood.,['Odor'],2023-11-30,2023-11-30,Baltimore City,2023-12-05,Incident Closed-Managed,
242,201821,He smells an industrial odor in the residential neighborhood.,['Odor'],2023-11-25,2023-11-25,Baltimore City,2023-12-05,Incident Closed-Managed,
243,201820,He smells an industrial odor in the residential neighborhood.,['Odor'],2023-11-17,2023-11-17,Baltimore City,2023-12-05,Incident Closed-Managed,
244,201819,He smells an industrial odor in the residential neighborhood.,['Odor'],2023-11-15,2023-11-15,Baltimore City,2023-12-05,Incident Closed-Managed,
245,201818,He smells an industrial odor in the residential neighborhood.,['Odor'],2023-11-04,2023-11-04,Baltimore City,2023-12-05,Incident Closed-Managed,
246,201814,Concern of smoke and dust in Bladensburg,['Other'],2023-12-04,2023-11-29,Prince George's,2023-12-08,Incident Closed-Managed,20781
247,201810,Neighbor has three modified diesel trucks releasing black smoke and particulate. The neighbor has also spilled oil on the road.,"['Air', 'Fugitive Dust/Particulate Matter', 'Smoke']",2023-12-01,2023-12-01,Montgomery,,Referred to Outside Agency,20902
248,201809,Odor from Annapolis Water Reclamation facility on Edgewood RD,['Air'],2023-12-01,2023-11-28,Anne Arundel,2023-12-08,Incident Closed-Managed,21403
249,191816,Noxious odors emanating from West Coast Mushrooms.,"['Air', 'Odor']",2023-11-30,2023-11-30,Cecil,,Referred to LMA,21911
250,191809,Buying new furniture and the AQ of it.,['Fumes'],2023-11-28,,Baltimore,,Incident Not Applicable to MDE,
251,191804,Construction of new Wawa Gas Station caused complainants asthma symptoms to worsen.,['Air Pollutant Release'],2023-11-28,2023-10-02,Montgomery,,Under Investigation,20877
252,191802,Moth ball odor in her apartment.  Complainant inquiring about testing the air inside her apartment.,['Air'],2023-11-28,2023-11-27,Anne Arundel,2023-11-29,Incident Closed - No further action,21114
253,191794,Dust from sand blasting,['Air'],2023-11-27,2023-11-27,Frederick,,Referred to Attorney General's Office,
254,191793,West Coast Mushroom Farm composting creates severe noxious odors.,"['Air', 'Odor']",2023-11-22,2023-11-22,Cecil,,Referred to LMA,21911
255,191783,concern of loud noise in the Cheverly area,['Other'],2023-11-21,2023-11-21,Prince George's,2023-11-22,Incident Closed-Managed,
256,191782,concern of loud noise in the Cheverly area,['Other'],2023-11-22,2023-11-21,Prince George's,2023-11-22,Incident Closed-Managed,
257,191781,concern of loud noise in the Cheverly area,['Other'],2023-11-21,2023-11-21,Prince George's,2023-11-22,Incident Closed-Managed,
258,191780,concern of loud noise in the Cheverly area,['Other'],2023-11-21,2023-11-21,Prince George's,2023-11-22,Incident Closed-Managed,
259,191779,concern of loud noise in the Cheverly area,['Other'],2023-11-20,2023-11-20,Prince George's,2023-11-22,Incident Closed-Managed,
260,191778,concern of loud noise in the Cheverly area,['Other'],2023-11-21,2023-11-21,Prince George's,2023-11-22,Incident Closed-Managed,
261,191777,concern of loud noise in the Cheverly area,['Other'],2023-11-20,2023-11-20,Prince George's,2023-11-22,Incident Closed-Managed,
262,191776,concern of loud noise in the Cheverly area,['Other'],2023-11-21,2023-11-21,Prince George's,2023-11-22,Incident Closed-Managed,
263,191775,concern of loud noise in the Cheverly area,['Other'],2023-11-21,2023-11-21,Prince George's,2023-11-22,Incident Closed-Managed,
264,191774,Grass cutting at West View Shores Civic Association is creating nuisance dust.,"['Air', 'Fugitive Dust/Particulate Matter']",2023-10-19,2023-10-19,Cecil,2023-11-21,Incident Closed-Managed,21919
265,191773,"The complainant States:
""West Coast Mushroom Farm in Rising Sun is creating severe noxious odors.""","['Air', 'Odor']",2023-11-16,2023-11-16,Cecil,,Referred to Outside Agency,21911
266,191772,Odors from cannabis facility,['Odor'],2023-11-21,,St. Mary's,,Referred to Outside Agency,
267,191769,Bees-Wings from Corn Dryer,['Fugitive Dust/Particulate Matter'],2023-11-21,2023-11-21,Washington,,Under Investigation,21742
268,191766,Dust from sandblasting and overspray from spray painting. Inadequate dust containment.,['Air'],2023-11-21,2023-11-21,Anne Arundel,,Referred to Attorney General's Office,
269,191760,Spice odors are being emitted from McCormicks.,['Odor'],2023-11-17,,Baltimore,2023-11-20,Incident Closed-Managed,
270,191759,concern of loud noise in the Cheverly area,['Other'],2023-11-17,2023-11-17,Prince George's,2023-11-20,Incident Closed-Managed,
271,191758,concern of loud noise in the Cheverly area,['Other'],2023-11-18,2023-11-18,Prince George's,2023-11-20,Incident Closed-Managed,
272,191757,concern of loud noise in the Cheverly area,['Other'],2023-11-19,2023-11-19,Prince George's,2023-11-20,Incident Closed-Managed,
273,191756,concern of loud noise in the Cheverly area,['Other'],2023-11-19,2023-11-19,Prince George's,2023-11-20,Incident Closed-Managed,
274,191754,concern of loud noise in the Cheverly area,['Other'],2023-11-19,2023-11-19,Prince George's,2023-11-20,Incident Closed-Managed,
275,191748,"Why is the air smoky/ hazy in Westminster, Carroll County, today?","['Air', 'Smoke']",2023-11-16,2023-11-16,Carroll,2023-11-16,Incident Closed-Managed,
276,191747,West Coast Mushroom Farm in Rising Sun is creating severe noxious odors.,"['Air', 'Odor']",2023-11-15,2023-11-13,Cecil,,Referred to Outside Agency,21911
277,191746,Odor,['Air'],2023-11-16,2023-11-16,Anne Arundel,,Referred to WMA,21403
278,191741,Fumes from the mechanical shop nearby are coming into the complainant's office building.,['Fumes'],2023-11-13,,Harford,2023-11-30,Incident Closed-No Violation Observed,21017
279,191739,Odors from vapors entering his house.,['Air'],2023-11-13,2023-11-13,Anne Arundel,,Incident Not Applicable to MDE,21225
280,191738,Smoke and odor from burning leaves in front yard firepit.,['Air'],2023-11-14,2023-11-12,Anne Arundel,,Under Investigation,
281,191737,Smoke and odor from neighbor's operating large ceramic pottery kilns.,['Air'],2023-11-11,2023-11-11,Frederick,2023-11-14,Incident Closed-Managed,21701
282,191736,Dust and Smoke,"['Fugitive Dust/Particulate Matter', 'Smoke']",2023-11-07,2023-11-07,Washington,2024-03-19,Incident Closed-Managed,21740
283,191735,Smoke from burning leaves.  Close to her house.,['Air'],2023-11-08,2023-11-08,Anne Arundel,2023-11-14,Incident Closed - No further action,21122
284,191731,"Trashy, swampy odor.  Complainant mentioned composting facility located on Quarantine Road, 21226",['Air'],2023-11-13,2023-11-10,Anne Arundel,,Under Investigation,
285,191730,"Trashy, swampy odor",['Air'],2023-11-13,2023-11-10,Anne Arundel,,Under Investigation,
286,191729,"Trashy, swampy odor",['Air'],2023-11-10,2023-11-10,Anne Arundel,,Under Investigation,21060
287,191726,"Dust from sand blasting vehicles, over spray from spray painting, no control equipment.  Needs Permit for sand blasting operations.",['Air'],2023-11-10,2023-11-10,Frederick,,Referred to Attorney General's Office,
288,191720,concern of mold and mildew in the apartment,['Other'],2023-11-07,2023-11-07,Prince George's,2023-11-08,Incident Closed-Managed,20784
289,191718,Concern of paint fumes from next neighbor,['Other'],2023-11-03,2023-11-03,Prince George's,2023-12-08,Incident Closed-Managed,20746
290,191715,Neighbor is burning trash that contains plastic. Burning is occurring in a burn barrel behind their barn.,"['Air', 'Open Burning']",2023-11-06,2023-11-06,Carroll,,Referred to Outside Agency,21158
291,191713,Home owner had mold remediation in his home and there are residual chemical odors.,['Odor'],2023-11-03,,Baltimore,,Incident Not Applicable to MDE,
292,191712,Odors from animals in abandoned house in neighborhood.,['Odor'],2023-11-02,,Baltimore,,Referred to Outside Agency,
293,191711,Concern of strong industrial smell off Rt 50,['Other'],2023-11-03,2023-11-03,Prince George's,2023-11-05,Incident Closed-Managed,
294,191710,Concern of fly ash,['Other'],2023-10-30,2023-10-30,Prince George's,2023-11-03,Incident Closed-Managed,
295,191707,Seasonal farm offers 3-hour rental campfire spaces.  Neighbors called FCHD about the smoke from the campfires.  Neighbor stated that his air monitoring device indicated excessive levels.,['Air'],2023-11-02,2023-11-02,Frederick,2023-11-16,Incident Closed - No further action,21769
296,191706,Smoke from neighbor's fire pit.,['Air'],2023-11-03,2023-11-02,Anne Arundel,,Under Investigation,
297,191705,Indoor white dust particles inside her apartment.,['Air'],2023-11-03,2023-10-31,Charles,2023-11-03,Incident Closed - No further action,
298,191704,He smells an industrial odor in the residential neighborhood.,['Odor'],2023-10-30,2023-10-30,Baltimore City,2023-11-02,Incident Closed-Managed,
299,191703,He smells an industrial odor in the residential neighborhood.,['Odor'],2023-10-29,2023-10-29,Baltimore City,2023-11-02,Incident Closed-Managed,
300,191702,He smells an industrial odor in the residential neighborhood.,['Odor'],2023-11-28,2023-10-28,Baltimore City,2023-11-02,Incident Closed-Managed,
301,191700,He smells an industrial odor in the residential neighborhood.,['Odor'],2023-10-27,2023-10-27,Baltimore City,2023-11-02,Incident Closed-Managed,
302,191699,Indoor Air Issue,['Odor'],2023-11-01,2023-11-01,Washington,2023-11-02,Incident Closed - No further action,21740
303,191697,Bees-Wings from Grain Dryer,['Fugitive Dust/Particulate Matter'],2023-10-26,2023-10-26,Washington,,Under Investigation,21742
304,191696,Bees-Wings from Grain Dryer,['Fugitive Dust/Particulate Matter'],2023-10-26,2023-10-26,Washington,,Under Investigation,21742
305,191693,Dust from sandblasting vehicles and overspray from spray paint.,['Air'],2023-11-01,2023-10-31,Frederick,,Referred to Attorney General's Office,
306,191692,Open burning smoke.  Complainant requests a letter to be sent to her neighbor.,['Air'],2023-10-31,2023-10-31,Anne Arundel,2023-11-14,Incident Closed - No further action,21144
307,191690,Indoor air issues of dust.  Would like samples collected.,['Air'],2023-11-01,2023-10-30,Anne Arundel,,Incident Not Applicable to MDE,
308,191689,Person from Georgia called MDE to report that Metro Sealant is selling non compliant solvents.,['Air'],2023-11-01,2023-10-26,Anne Arundel,,Under Investigation,
309,191686,"Odor from backriver wwtp on evening of 10/27, and several recent evenings","['Air', 'Odor']",2023-10-31,2023-10-27,Baltimore,2023-10-31,Incident Closed-Managed,21224
310,191684,there is a substance falling from a piece of equipment in a parking lot.,['Other'],2023-10-24,2023-10-24,Baltimore City,2023-10-31,Incident Closed-Managed,
311,191683,He smells an industrial odor in the residential neighborhood.,['Odor'],2023-10-24,2023-10-24,Baltimore City,2023-10-31,Incident Closed-Managed,
312,191682,He smells an industrial odor in the residential neighborhood.,['Odor'],2023-10-19,2023-10-19,Baltimore City,2023-10-31,Incident Closed-Managed,
313,191681,Calling to report FREON leak.,['Air Pollutant Release'],2023-10-16,2023-10-16,Baltimore City,2023-10-31,Incident Closed - No further action,
314,191680,"On May 6, 2023, the Complainant collect a sample strip of dust at the corner of Cypress St and Fairhaven Ave in Curtis Bay.  He analyzed the strip using a microscope and determined the dust to be coal from the CSX Coal Terminal.",['Air'],2023-10-11,2023-05-06,Baltimore City,2023-10-31,Incident Closed-Managed,21226
315,191677,Home is near CJ Miller Finksburg asphalt plant. Concerned with odor and emissions produced by the plant.,"['Air', 'Fumes', 'Odor']",2023-10-26,2023-10-26,Carroll,2023-10-30,Incident Closed-Managed,21048
316,191675,Overspray from neighbor spray painting a vehicle.,['Air'],2023-10-30,2023-10-30,Frederick,2023-10-30,Incident Closed - No further action,
317,191674,Smoke and odor from his neighbor's fire.,['Air'],2023-10-30,2023-10-28,Anne Arundel,2023-11-01,Incident Closed - No further action,21037
318,191671,Concern of strong odor in the Cheverly area.,['Other'],2023-10-24,2023-10-24,Prince George's,2023-10-27,Incident Closed-Managed,
319,191667,Dust from sandblasting of vehicles and overspray from spray paint.  Complainant's have submitted pictures and videos of dust.,['Air'],2023-10-26,2023-10-26,Frederick,,Clean-up Initiated,
320,191665,He smells an industrial odor in the residential neighborhood.,['Odor'],2023-10-12,2023-10-12,Baltimore City,2023-10-25,Incident Closed-Managed,
321,191664,He smells an industrial odor in the residential neighborhood.,['Odor'],2023-10-05,2023-10-05,Baltimore City,2023-10-25,Incident Closed-Managed,
322,191663,He smells an industrial odor in the residential neighborhood.,['Odor'],2023-09-26,2023-09-26,Baltimore City,2023-10-25,Incident Closed-Managed,
323,191662,He smells an industrial odor in the residential neighborhood.,['Odor'],2023-09-27,2023-09-27,Baltimore City,2023-10-25,Incident Closed-Managed,
324,191661,He smells an industrial odor in the residential neighborhood.,['Odor'],2023-09-20,2023-09-20,Baltimore City,2023-10-25,Incident Closed-Managed,
325,191660,He smells an industrial odor in the residential neighborhood.,['Odor'],2023-09-12,2023-09-12,Baltimore City,2023-10-25,Incident Closed-Managed,
326,191659,a construction site is creating dust in her neighborhood.,['Fugitive Dust/Particulate Matter'],2023-09-11,2023-09-11,Baltimore City,2023-10-25,Incident Closed-Managed,
327,191658,He smells an industrial odor in the residential neighborhood.,['Odor'],2023-09-11,2023-09-11,Baltimore City,2023-10-25,Incident Closed-Managed,
328,191657,He smells an industrial odor in the residential neighborhood.,['Odor'],2023-09-09,2023-09-09,Baltimore City,2023-10-25,Incident Closed-Managed,
329,191656,a construction site is creating dust in his neighborhood.,['Fugitive Dust/Particulate Matter'],2023-09-08,2023-09-08,Baltimore City,2023-10-25,Incident Closed-Managed,
330,191655,He smells an industrial odor in the residential neighborhood.,['Odor'],2023-09-07,2023-09-07,Baltimore City,2023-10-25,Incident Closed-Managed,
331,191650,Dust from sandblasting vehicles.  Overspray from spray painting.  Complainant submitted a picture of airborne dust created from the facility.,['Air'],2023-10-25,2023-10-25,Frederick,,Clean-up Initiated,
332,191648,Noise from the MTA Metro running by complainant's house.,['Noise Complaint'],2023-10-23,,Baltimore,,Incident Not Applicable to MDE,
333,191646,Dust from sand blasting and overspray from spray painting,['Air'],2023-10-24,2023-10-24,Frederick,,Clean-up Initiated,
334,191644,Dust from sandblasting and spray paint overspray.  3 NOV's issued.  PTC issued for vehicle refinishing.  Outstanding issues of need for Permit for sand blasting of vehicles and needs dust control equipment.,['Air'],2023-10-24,2023-10-24,Frederick,,Clean-up Initiated,
335,191643,Concrete odor and dumping into rainwater sewer and may be improperly strip mining.  FY-24-283511-3714-CV,['Air'],2023-10-24,2023-10-23,Charles,,Under Investigation,
336,191638,Concern of loud boom noise,['Other'],2023-10-19,2023-10-19,Prince George's,2023-10-20,Incident Closed-Managed,20743
337,191637,Dust or Smoke,"['Fugitive Dust/Particulate Matter', 'Smoke']",2023-10-18,2023-10-05,Allegany,2024-02-02,Incident Closed - No further action,21540-109
338,191635,Concern of noise in Cheverly Area,['Other'],2023-10-19,2023-10-19,Prince George's,2023-10-20,Incident Closed-Managed,
339,191634,Bees Wings,['Fugitive Dust/Particulate Matter'],2023-10-18,2023-10-18,Washington,,Under Investigation,21742
340,181632,ST. Mary's Child Care Division received a call about a musty odor inside of a child care facility.,['Air'],2023-10-19,2023-10-19,St. Mary's,,Incident Not Applicable to MDE,
341,181626,smoke from burning trash and leaves,['Air'],2023-10-18,2023-10-16,Anne Arundel,2023-10-23,Incident Closed-No Violation Observed,21037
342,181625,smoke from burning trash,['Air'],2023-10-16,2023-10-16,Frederick,2023-10-19,Incident Closed - No further action,
