sno,complaint,complaint_description,complaint_type,recieved_date,incident_date,county,incident_closed_date,incident_status_desc,incident_zip
518,161070,He smells an industrial odor in the residential neighborhood.,['Odor'],2023-05-09,2023-05-09,Baltimore City,2023-06-07,Incident Closed-Managed,
520,161065,He smells an industrial odor in the residential neighborhood.,['Odor'],2023-05-08,2023-05-08,Baltimore City,2023-06-06,Incident Closed-Managed,
521,161064,Concern of odor and emission from asphalt,['Other'],2023-06-05,2023-06-05,Howard,2023-06-06,Incident Closed-Managed,
522,161063,Construction dust affecting apartment resident,['Other'],2023-06-01,2023-06-01,Prince George's,2023-06-06,Incident Closed-Managed,
523,161062,He smells an industrial odor in the residential neighborhood.,['Odor'],2023-05-07,2023-05-07,Baltimore City,2023-06-06,Incident Closed-Managed,
524,161061,Concern of odor from asphalt plant,['Other'],2023-06-01,2023-06-01,Howard,2023-06-06,Incident Closed-Managed,21075
525,161060,He smells an industrial odor in the residential neighborhood.,['Odor'],2023-05-06,2023-05-06,Baltimore City,2023-06-06,Incident Closed-Managed,
526,161059,concern of odor and emission from asphalt plant,['Other'],2023-05-31,2023-05-31,Howard,2023-06-06,Incident Closed-Managed,21075
527,161058,concern of odor and emissions from asphalt plant,['Other'],2023-05-23,2023-05-23,Howard,2023-06-06,Incident Closed-Managed,21075
528,161057,He smells an industrial odor in the residential neighborhood.,['Odor'],2023-05-05,2023-05-05,Baltimore City,2023-06-06,Incident Closed-Managed,
529,161055,Dust from sandblasting vehicles and vehicle parts.  Overspray from spray painting.,['Air'],2023-06-06,2023-06-03,Anne Arundel,,Under Investigation,
530,161054,Dust from demolition of building,['Air'],2023-06-06,2023-06-02,Anne Arundel,2023-10-27,Incident Closed-No Violation Observed,
531,161042,Dust from sand blasting vehicles and overspray from spray painting,['Air'],2023-06-02,2023-06-02,Frederick,,Under Investigation,
532,161041,Dust from sand blasting vehicles and overspray from spray painting.,['Air'],2023-06-02,2023-05-31,Frederick,,Under Investigation,
533,161040,Dust from sand blasting vehicles & overspray from spray painting.,['Air'],2023-06-02,2023-05-26,Frederick,,Under Investigation,
534,161035,Smoke from burning leaves at her neighbor's house.,['Air'],2023-06-02,2023-06-01,Anne Arundel,,Under Investigation,
535,161034,Inquiry about open burning and fire pits.,['Air'],2023-06-02,2023-05-31,Anne Arundel,2023-06-02,Incident Closed - No further action,
536,161033,Complainant detected a chemical odor in the air near her residence.,['Air'],2023-06-02,2023-05-31,Anne Arundel,2023-06-02,Incident Closed-No Violation Observed,21113
537,161032,Dust from neighbor cutting stones for a patio or sidewalk.,['Air'],2023-06-02,2023-05-30,Anne Arundel,2023-06-02,Incident Closed - No further action,
538,161031,Dust from constructing baseball fields at GORC park which is located adjacent to the Complainant's house.  Trees in between properties.,['Air'],2023-06-02,2023-05-26,Anne Arundel,2023-06-12,Incident Closed-No Violation Observed,21113
539,161030,Question re open burning,['Other'],2023-06-01,,St. Mary's,2023-06-02,Incident Closed - No further action,
540,161027,Neighbor is having siding installed. Construction company is cutting PVC components without dust suppression. Causing fugitive dust issues.,"['Air', 'Fugitive Dust/Particulate Matter']",2023-05-31,2023-05-31,Montgomery,,Referred to Outside Agency,20912
541,161012,Concerned with fumes from roof tarring and other construction activity and the health effects on students.,"['Air', 'Fumes', 'Odor']",2023-05-25,2023-05-25,Montgomery,2023-09-21,Incident Closed-Managed,20853
542,161012,Concerned with fumes from roof tarring and other construction activity and the health effects on students.,"['Air', 'Fumes', 'Odor']",2023-05-25,2023-05-25,Montgomery,2023-09-21,Incident Closed-Managed,20837
543,161008,Requested info for Balto co burn permit,['Other'],2023-05-25,,Baltimore,2023-05-26,Incident Closed - No further action,
544,161002,Dust from sandblasting vehicles and vehicle parts.  No dust control measures.  Dust exits concrete building to outside and crosses property.,['Air'],2023-05-24,2023-05-24,Frederick,,Under Investigation,
545,161000,"Smoke, odors and fumes from restaurant outdoor smokers.","['Fumes', 'Odor', 'Smoke']",2023-05-23,2023-05-23,Wicomico,2023-05-24,Incident Closed-Managed,21801
546,160992,Horrendous odor in area around facility.,['Odor'],2023-05-22,2023-05-13,Baltimore,2023-05-22,Incident Closed - No further action,21222
547,160990,"Concerned that seals in place throughout inside of school are not properly installed, leading to infiltration of roof tar odors inside Poolesville High School.","['Air', 'Fumes', 'Odor']",2023-05-19,2023-05-19,Montgomery,2023-09-21,Incident Closed-Managed,20837
548,160989,Health concerns regarding roofing tar used at Poolesville High School and Parkland Middle School.,"['Air', 'Fumes', 'Odor']",2023-05-19,2023-05-19,Montgomery,2023-09-21,Incident Closed-Managed,20853
549,160989,Health concerns regarding roofing tar used at Poolesville High School and Parkland Middle School.,"['Air', 'Fumes', 'Odor']",2023-05-19,2023-05-19,Montgomery,2023-09-21,Incident Closed-Managed,20837
550,160986,Airplane is spraying chemicals on neighboring farm.,['Fumes'],2023-05-18,,Baltimore,,Referred to Outside Agency,
551,160982,Dust from land excavation.  Construction site for a new building.  Dust blowing onto to residence property.,['Air'],2023-05-19,2023-05-18,Frederick,2023-11-17,Incident Closed - No further action,
552,160982,Dust from land excavation.  Construction site for a new building.  Dust blowing onto to residence property.,['Air'],2023-05-19,2023-05-18,Frederick,2023-11-17,Incident Closed - No further action,
553,160981,Burning green wood in backyard firepit and creating smoke.,['Air'],2023-05-19,2023-05-17,Anne Arundel,2023-05-19,Incident Closed - No further action,
554,150983,Health concerns related to construction activity at Poolesville High School and Parkland Magnet Middle School.,"['Air', 'Fumes', 'Odor']",2023-05-16,2023-05-16,Montgomery,2023-09-21,Incident Closed-Managed,20853
555,150983,Health concerns related to construction activity at Poolesville High School and Parkland Magnet Middle School.,"['Air', 'Fumes', 'Odor']",2023-05-16,2023-05-16,Montgomery,2023-09-21,Incident Closed-Managed,20837
556,150982,Health concerns related to roofing tar exposure at Parkland Magnet Middle School.,"['Air', 'Fumes', 'Odor']",2023-05-16,2023-05-16,Montgomery,2023-09-21,Incident Closed-Managed,20853
557,150981,Automotive business painting cars in tent behind building. EPA referral.,['Air'],2023-05-09,2023-05-09,Montgomery,2023-05-18,Incident Closed-Managed,20879
558,150978,Odor Complaint,['Odor'],2023-05-04,2023-05-04,Dorchester,2023-05-04,Incident Closed - No further action,21835
559,150977,Fumes from the generator next door.,['Fumes'],2023-05-16,,Baltimore,2023-05-17,Incident Closed-Managed,
560,150965,"Continued concerns regarding construction activity at Poolesville High School. Concerns include roof tarring, fireproofing, and acoustic foam installation.","['Air', 'Fumes', 'Odor']",2023-05-15,2023-05-15,Montgomery,2023-09-21,Incident Closed-Managed,20837
561,150964,Apt building next door's generator is creating fumes.,['Fumes'],2023-05-15,,Baltimore,2023-05-17,Incident Closed-Managed,
562,150963,Neighbor's dog and cat feces,['Odor'],2023-05-15,,Baltimore,,Referred to Outside Agency,
563,150958,Neighbor's van leaks motor oil on the parking lot in their townhouse neighborhood.,['Air'],2023-05-15,2023-05-12,Frederick,2023-05-15,Incident Closed - No further action,
564,150957,Dust from sand blasting and spray painting,['Air'],2023-05-15,2023-05-09,Frederick,,Under Investigation,
565,150956,Smoke from burning leaves at neighbor's yard.,['Air'],2023-05-15,2023-05-08,Anne Arundel,2023-05-15,Incident Closed-No Violation Observed,
566,150951,Smoke observed at Aberdeen Proving Ground.,['Smoke'],2023-05-12,2023-03-09,Harford,2023-05-12,Incident Closed - No further action,
567,150950,Smoke observed at Aberdeen Proving Ground.,['Smoke'],2023-05-12,2023-03-09,Harford,2023-05-12,Incident Closed - No further action,
568,150949,Smoke observed at Aberdeen Proving Ground.,['Smoke'],2023-05-12,2023-03-09,Harford,2023-05-12,Incident Closed - No further action,
569,150947,Poolesville High School construction project concerns. Including roof tar and indoor air quality.,"['Air', 'Fumes', 'Odor']",2023-05-11,2023-05-11,Montgomery,2023-09-21,Incident Closed-Managed,20837
570,150946,Battery acid or sulfates being sprayed in the air system at Walmart.,['Air'],2023-05-12,2023-05-11,Charles,2023-06-14,Incident Closed-No Violation Observed,20601
571,150945,Poolesville High School parent concerned with roof tarring and application of fireproofing material at the school.,"['Air', 'Fumes', 'Odor']",2023-05-07,2023-05-07,Montgomery,2023-09-21,Incident Closed-Managed,20837
572,150941,Odor Complaint,['Odor'],2023-04-07,2023-04-07,Howard,2023-04-07,Incident Closed - No further action,20723
573,150938,"Wolff Tree & Landscape, LLC may have tub grinders on-site used for wood processing.","['Air', 'Other']",2023-04-20,2023-04-20,Carroll,,Referred to Outside Agency,21776-811
574,150932,Bus Idling at elementary school,['Other'],2023-05-08,2023-05-08,Prince George's,2023-05-10,Incident Closed-Managed,
575,150931,Indoor air quality,['Other'],2023-05-03,2023-05-03,Prince George's,2023-06-14,Incident Closed-Managed,
576,150930,A business is sand blasting containers and painting them outside.,['Fugitive Dust/Particulate Matter'],2023-04-20,2023-04-20,Baltimore City,2023-05-09,Incident Closed-Managed,
577,150929,He smells an industrial odor in the residential neighborhood.,['Odor'],2023-04-26,2023-04-26,Baltimore City,2023-05-09,Incident Closed-Managed,
578,150928,He smells an industrial odor in the residential neighborhood.,['Odor'],2023-04-23,2023-04-23,Baltimore City,2023-05-09,Incident Closed-Managed,
579,150927,He smells an industrial odor in the residential neighborhood.,['Odor'],2023-04-22,2023-04-22,Baltimore City,2023-05-09,Incident Closed-Managed,
580,150926,He smells an industrial odor in the residential neighborhood.,['Odor'],2023-04-21,2023-04-21,Baltimore City,2023-05-09,Incident Closed-Managed,
581,150925,Video submitted via cell phone of dust created from the facility.,['Air'],2023-05-09,2023-05-09,Frederick,,Under Investigation,
582,150916,Seafood odor from storage of fish & shellfish at the homeowner's house.,['Air'],2023-05-08,2023-05-04,Anne Arundel,2023-05-08,Incident Closed-No Violation Observed,
583,150915,Odor from smoke,['Air'],2023-05-08,2023-05-04,Anne Arundel,2023-05-19,Incident Closed - No further action,
584,150914,Odor from dirty radiator coils inside apartment.,['Air'],2023-05-08,2023-05-03,Anne Arundel,2023-05-19,Incident Closed - No further action,
585,150902,Fire being fed by backhoe.,['Open Burning'],2023-05-03,2023-05-03,Somerset,2023-05-03,Incident Closed-No Violation Observed,21853
586,150896,Odor,['Odor'],2023-05-02,,Baltimore,2023-05-08,Incident Closed-No Violation Observed,21093
587,150894,Concerns regarding indoor air quality after replacing HVAC in home.,"['Air', 'Other']",2023-05-01,2023-05-01,Cecil,2023-05-02,Incident Closed - No further action,
588,150891,Noise and vibrations being created by neighbors. Cecil County Sheriff referral to MDE.,['Other'],2023-04-28,2023-04-28,Cecil,,Referred to Outside Agency,21901
589,150887,Cat urine odor from townhouse,['Air'],2023-05-01,2023-04-28,Anne Arundel,2023-05-05,Incident Closed - No further action,
590,150886,Smoke from burning trash,['Air'],2023-05-01,2023-04-26,Anne Arundel,,Under Investigation,
591,150867,Laundry company is emitting lint from its dryer vents.,['Other'],2023-04-27,,Baltimore,2023-04-27,Incident Closed-Managed,
592,150864,DPS Automotive is creating dust from work being performed. Concerned that facility is not permitted and painting vehicle parts.,"['Air', 'Fugitive Dust/Particulate Matter']",2023-04-20,2023-04-20,Montgomery,2023-04-27,Incident Closed-Managed,20852
593,150854,Smoke from open burning at nights and on weekends.,"['Open Burning', 'Smoke']",2023-04-19,2023-04-19,Worcester,2023-05-02,Incident Closed-No Violation Observed,21851
594,150854,Smoke from open burning at nights and on weekends.,"['Open Burning', 'Smoke']",2023-04-19,2023-04-19,Worcester,2023-05-02,Incident Closed-No Violation Observed,21851
595,150854,Smoke from open burning at nights and on weekends.,"['Open Burning', 'Smoke']",2023-04-19,2023-04-19,Worcester,2023-05-02,Incident Closed-No Violation Observed,21851
596,150854,Smoke from open burning at nights and on weekends.,"['Open Burning', 'Smoke']",2023-04-19,2023-04-19,Worcester,2023-05-02,Incident Closed-No Violation Observed,21851
597,150854,Smoke from open burning at nights and on weekends.,"['Open Burning', 'Smoke']",2023-04-19,2023-04-19,Worcester,2023-05-02,Incident Closed-No Violation Observed,21851
598,150848,Burning,['Open Burning'],2023-04-23,,Harford,2023-04-28,Incident Closed-Managed,
599,150843,He smells an industrial odor in the residential neighborhood.,['Odor'],2023-04-16,2023-04-16,Baltimore City,2023-04-21,Incident Closed-Managed,
600,150842,He smells an industrial odor in the residential neighborhood.,['Odor'],2023-04-03,2023-04-03,Baltimore City,2023-04-21,Incident Closed-Managed,
601,150841,He smells an industrial odor in the residential neighborhood.,['Odor'],2023-03-29,2023-03-29,Baltimore City,2023-04-21,Incident Closed-Managed,
602,150840,He smells an industrial odor in the residential neighborhood.,['Odor'],2023-03-27,2023-03-27,Baltimore City,2023-04-21,Incident Closed-Managed,
603,150839,He smells an industrial odor in the residential neighborhood.,['Odor'],2023-03-26,2023-03-26,Baltimore City,2023-04-21,Incident Closed-Managed,
604,150837,He smells an industrial odor in the residential neighborhood.,['Odor'],2023-03-25,2023-03-25,Baltimore City,2023-04-21,Incident Closed-Managed,
605,140835,No dust suppression,['Fugitive Dust/Particulate Matter'],2023-04-19,,Baltimore,2023-04-24,Incident Closed - No further action,
606,140834,Smoke from burning hazardous waste at the marina.  Complainant stated she spoke to someone last week and they were going to send someone out.,['Air'],2023-04-20,2023-04-20,Anne Arundel,,Under Investigation,
609,140827,Concern of burning tires in the Cheverly area,['Other'],2023-04-12,2023-04-12,Prince George's,2023-04-19,Incident Closed-Managed,
610,140826,Dust from sand blasting & spray painting commercial vehicles.  Picture received.,['Air'],2023-04-19,2023-04-19,Frederick,,Under Investigation,
611,140816,Picture & video of dust from sand blasting and going onto next property.,['Air'],2023-04-17,2023-04-17,Frederick,,Under Investigation,
612,140809,Metallic odor detected in the middle of the night.,['Odor'],2023-04-14,,Baltimore,2023-04-14,Incident Closed - No further action,
613,140797,Concern of Loud boom noise,['Other'],2023-04-09,2023-04-09,Prince George's,2023-04-12,Incident Closed-Managed,
614,140796,Concern of loud boom noise in Cheverly area,['Other'],2023-04-09,2023-04-09,Prince George's,2023-04-12,Incident Closed-Managed,
615,140795,Concern of awful smell in Cheverly area,['Other'],2023-04-10,2023-04-10,Prince George's,2023-04-12,Incident Closed-Managed,
616,140792,Concern of mold in school,['Other'],2023-04-12,2023-04-04,Prince George's,2023-04-12,Incident Closed-Managed,
617,140791,Odor concern in Cheverly area,['Other'],2023-04-04,2023-04-04,Prince George's,2023-04-12,Incident Closed-Managed,
618,140782,Concerns related to odors and other issues related to roofing project at Poolesville High School.,"['Air', 'Fumes', 'Odor']",2023-04-10,2023-04-10,Montgomery,,Referred to Outside Agency,20837
619,140781,Severe roofing tar odors infiltrating Poolesville High School due to continued roof construction.,"['Air', 'Fumes', 'Odor']",2023-03-30,2023-03-30,Montgomery,,Referred to Outside Agency,20837
620,140780,Office building across from condominium complex has approval from Montgomery County to be retrofitted to become life science labs. Concerned with potential chemical exhaust from labs.,"['Air', 'Fumes', 'Other']",2023-03-30,2023-03-30,Montgomery,,Referred to Outside Agency,20847
621,140778,Odor from spray that was applied to millings in a parking lot.,['Air'],2023-04-10,2023-04-10,Frederick,2023-04-10,Incident Closed - No further action,21757
622,140777,"Neighbor is continuously burning trash, plastics, chemicals, etc.","['Fumes', 'Open Burning', 'Smoke']",2023-03-31,2023-03-31,Cecil,,Referred to Outside Agency,21919
623,140776,Complaint received via email from the Cecil County Health Department. Illegal scrapyard is constantly open burning waste materials.,"['Open Burning', 'Smoke']",2023-03-31,2023-03-31,Cecil,,Referred to Outside Agency,21921
624,140775,Water main on the street was replaced. Replacement caused dust. Also there are storm water runoff concerns.,['Fugitive Dust/Particulate Matter'],2023-04-05,2023-04-05,Cecil,2023-04-07,Incident Closed - No further action,
625,140774,Neighbors are continuously open burning causing nuisance smoke.,"['Open Burning', 'Smoke']",2023-04-05,2023-04-05,Cecil,,Referred to Outside Agency,21919
626,140773,Neighbor burning and creating smoke,['Smoke'],2023-04-05,,St. Mary's,2023-04-07,Incident Closed-Managed,
627,140772,Neighbor is burning and creating smoke.,['Smoke'],2023-04-03,,St. Mary's,2023-04-07,Incident Closed-Managed,
628,140771,Neighbor is creating smoke and odor inside their home. The smoke and odor is infiltrating the complainant's townhome.,"['Air', 'Odor', 'Smoke']",2023-04-06,2023-04-06,Montgomery,,Referred to Outside Agency,
629,140769,"Black smoke, can't walk outside.",['Smoke'],2023-04-05,2023-04-05,Wicomico,2023-04-06,Incident Closed - No further action,21849
630,140768,Smoke and Odors from Burning Construction Scraps,"['Fumes', 'Smoke']",2023-04-05,2023-04-05,Garrett,2023-05-26,Incident Closed-Managed,21536
631,140767,Possible Asbestos,['Asbestos Complaint'],2023-03-21,2023-03-21,Allegany,,Referred to ARA,21501
632,140766,Possible Endangered Species,['Other'],2023-03-17,2023-03-17,Allegany,2023-04-06,Incident Closed - No further action,
633,140765,Possible Asbestos in Home,['Asbestos Complaint'],2023-03-10,2023-03-10,Allegany,,Referred to ARA,
635,140761,"Caller said that their tenant complained of a strong ""alcohol"" odor near H&S Bakery in Baltimore City on the night of March 30, 2023.",['Odor'],2023-04-05,2023-03-30,Baltimore City,2023-04-07,Incident Closed - No further action,21231
636,140760,Indoor air.  Mold in basement.,['Air'],2023-04-05,2023-04-05,Anne Arundel,2023-04-05,Incident Closed-No Violation Observed,
637,140757,Odor Complaint,['Odor'],2023-03-24,2023-03-24,Dorchester,2023-03-24,Incident Closed - No further action,21835
638,140756,Odor Complaint,['Odor'],2023-04-03,2023-04-03,Baltimore City,2023-04-03,Incident Closed - No further action,21224
639,140752,"3/29/2023 picture of dust.  4/3/2023 Video shows dust exiting building through a window fan.  Site inspection 4/3/2023, no activity at the time of the site inspection.",['Air'],2023-04-04,2023-04-03,Frederick,2023-06-21,Incident Closed-Managed,
640,140751,Smoke from neighbor's fire pit,['Air'],2023-04-04,2023-04-02,Anne Arundel,2023-04-04,Incident Closed-No Violation Observed,
641,140750,Severe chemical odor/ fumes coming from Appalachian Railcar/ Cathcart. Also noise concerns.,"['Air', 'Fumes', 'Odor']",2023-03-31,2023-03-31,Cecil,2023-04-03,Incident Closed-Managed,21920
642,140734,Dust from sand blasting & spray painting vehicles without containment.  Picture of dust submitted from 3/29/2023.,['Air'],2023-03-31,2023-03-29,Frederick,2023-06-21,Incident Closed-Managed,21757
643,140732,Concern of dust from hired contractor to renovate property,['Other'],2023-03-29,2023-03-29,Prince George's,2023-03-31,Incident Closed-Managed,
644,140729,Roofing concern,['Other'],2023-03-29,,Baltimore,2023-03-30,Incident Closed - No further action,
645,140728,Neighbor is open burning,['Smoke'],2023-03-28,,Baltimore,,Referred to Outside Agency,
646,140726,Open burning yard waste creating a nuisance.,"['Odor', 'Smoke']",2023-03-30,2023-03-26,Caroline,,Referred to Outside Agency,21629
647,140716,Tar odors/ fumes causing health concerns at Poolesville High School. Is requesting that MDE test the air at Poolesville High School.,"['Air', 'Fumes', 'Odor']",2023-03-27,2023-03-27,Montgomery,,Referred to Outside Agency,20837
648,140715,concern of burning tire in Riverdale/College park,['Other'],2023-03-27,2023-03-27,Prince George's,2023-03-29,Incident Closed-Managed,
649,140714,Concern of odor from asphalt plant on E windy day,['Odor'],2023-03-27,2023-03-27,Howard,2023-06-06,Incident Closed-Managed,21075
650,140713,Odor,['Odor'],2023-03-24,2023-03-24,Dorchester,2023-03-24,Incident Closed-Managed,21835
651,140712,Tar odors/ fumes causing health concerns at Poolesville High School. Was informed MDE would being inspecting Poolesville High School from another parent.,"['Air', 'Fumes', 'Odor']",2023-03-27,2023-03-27,Montgomery,2023-09-21,Incident Closed-Managed,20837
652,140710,Noxious odor throughout downtown Bethesda.,"['Air', 'Fumes', 'Odor', 'Smoke']",2023-03-27,2023-03-27,Montgomery,2023-03-28,Incident Closed-Managed,
653,140709,Smokey odors in air throughout Takoma Park and Silver Spring.,"['Air', 'Fumes', 'Smoke']",2023-03-27,2023-03-27,Montgomery,2023-03-28,Incident Closed-Managed,
654,140708,Students and staff at Poolesville High School are being exposed to toxic fumes from roof tarring and construction activity.,"['Air', 'Fumes', 'Odor']",2023-03-22,2023-03-22,Montgomery,,Referred to Outside Agency,20837
655,140707,Odor,['Air'],2023-03-28,2023-03-26,Anne Arundel,,Under Investigation,21060
656,140706,"Burning plastic, acrid odor in the area.",['Air'],2023-03-28,2023-03-27,Anne Arundel,2023-03-28,Incident Closed - No further action,
658,140704,Open Burning at residence. Odors of burning plastics and oils.,"['Fumes', 'Odor', 'Open Burning']",2023-03-22,2023-03-22,Carroll,,Referred to Outside Agency,21776
659,140700,See complaint #140690,['Fugitive Dust/Particulate Matter'],2023-03-26,,Harford,2023-03-27,Incident Closed-No Violation Observed,21001
660,140696,Odor Complaint,['Odor'],2023-03-22,2023-03-22,Anne Arundel,2023-03-22,Incident Closed - No further action,21226
661,140690,Dust from crushing,['Fugitive Dust/Particulate Matter'],2023-03-23,,Harford,2023-03-27,Incident Closed-No Violation Observed,
662,140676,Smoke from neighbor smoking and burning incense inside apartment building.,['Air'],2023-03-22,2023-03-22,Anne Arundel,2023-03-22,Incident Closed - No further action,
663,140674,Dust from sawing,['Fugitive Dust/Particulate Matter'],2023-03-21,,Baltimore,2023-03-28,Incident Closed-No Violation Observed,
664,140673,Smoke coming from crematory stack.,['Smoke'],2023-03-18,,Baltimore,2023-03-22,Incident Closed-No Violation Observed,21228
665,140671,Dust created from sandblasting & spray painting vehicles.  Dust crosses property line.  Pictures submitted.,['Air'],2023-03-22,2023-03-22,Frederick,,Under Investigation,21757
666,140670,Dust created from sand blasting and spray painting vehicles.  Dust crosses property line.  Pictures submitted.,['Air'],2023-03-22,2023-03-21,Frederick,,Under Investigation,21757
667,140654,Smoke from neighbor's indoor wood burning stove.,['Air'],2023-03-20,2023-03-20,Anne Arundel,2023-03-28,Incident Closed - No further action,
668,140652,indoor air quality in a school,['Other'],2023-03-15,2023-03-13,Queen Anne's,2023-03-15,Incident Closed-Managed,21638
669,140651,Open burning creating a nuisance.,['Open Burning'],2023-03-14,2023-03-14,Somerset,2023-03-15,Incident Closed-Managed,21853
670,140649,He smells an industrial odor in the residential neighborhood.,['Odor'],2023-03-17,2023-03-17,Baltimore City,2023-03-17,Incident Closed-Managed,
671,140648,He smells an industrial odor in the residential neighborhood.,['Odor'],2023-03-12,2023-03-12,Baltimore City,2023-03-17,Incident Closed-Managed,
672,140647,He smells an industrial odor in the residential neighborhood.,['Odor'],2023-03-10,2023-03-10,Baltimore City,2023-03-17,Incident Closed-Managed,
673,140646,Fumes coming from nearby farm,['Fumes'],2023-03-17,,Baltimore,2023-03-17,Incident Closed - No further action,
674,140645,Question regarding burn,['Other'],2023-03-13,,St. Mary's,2023-03-17,Incident Closed - No further action,
675,140644,White specks on car.,['Other'],2023-03-13,,Baltimore,2023-03-17,Incident Closed - No further action,
676,140640,Odor Complaint,['Odor'],2023-03-10,2023-03-10,Dorchester,2023-03-10,Incident Closed - No further action,21835
680,140634,Rotten fish and trash odor in her neighborhood.,['Air'],2023-03-15,2023-03-10,Anne Arundel,,Under Investigation,21060
684,140627,Concerns regarding marijuana smoke infiltrating condominium unit from neighboring condominium units.,"['Air', 'Odor', 'Smoke']",2023-03-13,2023-03-13,Montgomery,,Referred to Outside Agency,
686,140624,Explained as a gas & trash burning odor.,['Air'],2023-03-13,2023-03-10,Anne Arundel,2023-03-13,Incident Closed-No Violation Observed,
687,140618,Foul odor detected in the neighborhood.  Odor survey to be conducted.,['Air'],2023-03-10,2023-03-09,Anne Arundel,,Under Investigation,21060
688,140616,Odors in Perry Hall,['Odor'],2023-03-10,,Baltimore,2023-03-10,Incident Closed - No further action,
693,140607,"Several implosion sounds, house shook, black smoke plumes in the air.  Pictures attached.
One additional complaint came in today about the sound situation.  That Complainant from Harford County mentioned Aberdeen.",['Air'],2023-03-10,2023-03-09,Anne Arundel,,Under Investigation,21122
