sno,complaint,complaint_description,complaint_type,recieved_date,incident_date,county,incident_closed_date,incident_status_desc,incident_zip
343,181624,Smoke from neighbor's wood burning stove.  Wood burning stove located inside neighbor's house.,['Air'],2023-10-17,2023-10-17,Anne Arundel,2023-10-18,Incident Closed - No further action,
344,181622,Neighbor is painting,['Other'],2023-10-16,,Baltimore,2023-10-17,Incident Closed-Managed,
345,181621,Odors,['Odor'],2023-10-15,,Baltimore,2023-10-17,Incident Closed-No Violation Observed,
346,181617,"Neighbor is open burning, causing nuisance odors and smoke.","['Air', 'Odor', 'Open Burning', 'Smoke']",2023-10-10,2023-10-10,Cecil,2023-10-16,Incident Closed-Managed,21919
347,181616,McCandless Inc. sandblasts and paints/ recoats heavy industrial equipment without the required containment. Site does not have spray booth or sandblasting containment.,"['Air', 'Fugitive Dust/Particulate Matter', 'Other', 'Suspected Operation without Permit']",2023-10-11,2023-10-11,Cecil,2023-11-21,Incident Closed-Managed,21901
348,181615,Neighbor in condominium building is burning incense and smoking cannabis. Odors are creating severe health issues.,"['Air', 'Fumes', 'Odor']",2023-10-13,2023-10-13,Montgomery,2023-10-16,Incident Closed-Managed,20852
349,181613,Mold,['Other'],2023-10-11,2023-10-11,Allegany,2023-10-16,Incident Closed - No further action,
350,181612,Mold,['Other'],2023-10-10,2023-10-10,Allegany,2023-10-16,Incident Closed - No further action,
351,181611,Smoke and Odor from OWB,['Smoke'],2023-09-27,2023-09-27,Allegany,2023-11-21,Incident Closed - No further action,21562
352,181609,mold,['Air'],2023-10-13,2023-10-13,Anne Arundel,,Incident Not Applicable to MDE,
353,181607,strong odor of sewage in Cheverly Area,['Other'],2023-10-05,2023-10-05,Prince George's,2023-10-13,Incident Closed-Managed,
354,181606,Improper Waste/ materials handling concern,['Other'],2023-10-05,2023-10-05,Prince George's,2023-11-05,Incident Closed-Managed,
355,181605,Concern of grinding noise off rt 50,['Other'],2023-10-03,2023-10-03,Prince George's,2023-10-13,Incident Closed-Managed,
356,181598,Dust,['Air'],2023-10-11,2023-10-11,Frederick,2023-10-13,Incident Closed-Clean-up Completed,21701
357,181596,Paint going into air from sandblasting & painting bridge.,['Fugitive Dust/Particulate Matter'],2023-10-03,2023-10-03,Kent,2023-10-06,Incident Closed-No Violation Observed,
358,181595,Odors from Curio.,['Odor'],2023-10-09,,Baltimore,2023-10-17,Incident Closed-No Violation Observed,21093
359,181594,Smoke coming into complainant's house from smokers next door.,['Smoke'],2023-10-10,,Baltimore,,Incident Not Applicable to MDE,
360,181593,Dust from sand blasting of vehicles,['Air'],2023-10-10,2023-10-09,Frederick,,Clean-up Initiated,21757
361,181588,Dust from sand blasting and overspray from spray painting in driveway crossing property line.,['Air'],2023-10-05,2023-10-05,Frederick,2023-10-06,Incident Closed - No further action,21771
362,181587,Dust from neighbors driving on their shared gravel driveway.,['Air'],2023-10-03,2023-10-03,Frederick,2023-10-20,Incident Closed - No further action,
363,181586,Dust from sand blasting of commercial vehicles.,['Air'],2023-10-04,2023-10-04,Frederick,,Clean-up Initiated,21757
364,181585,Odor of sewage from backriver wwtp in Havens' 21222,"['Air', 'Odor']",2023-10-05,2023-10-04,Baltimore,2023-10-05,Incident Closed-Managed,21224
365,181584,Odors coming from her microwave.,['Odor'],2023-10-04,,Harford,,Incident Not Applicable to MDE,
366,181582,Severe odors in the Rising Sun area suspected to be West Coast Mushrooms. Daughter has leukemia and concerned with the health impact.,['Odor'],2023-10-04,2023-10-04,Cecil,,Referred to Outside Agency,21911
367,181579,Dust from sandblasting commercial vehicles.,['Air'],2023-10-04,2023-10-04,Frederick,,Clean-up Initiated,
368,181578,Concern of high pitch noise from elementary school,['Other'],2023-10-02,2023-10-02,Prince George's,2023-10-04,Incident Closed-Managed,
369,181577,Concern of smell of gas and formaldehyde,['Other'],2023-08-29,2023-09-29,Prince George's,2023-10-04,Incident Closed-Managed,
370,181574,Odors in Dundalk High School,['Odor'],2023-10-03,,Baltimore,2023-10-03,Incident Closed-Managed,
371,181573,Odor from the dairy facility,['Air'],2023-10-03,2023-10-03,Frederick,2023-10-13,Incident Closed-No Violation Observed,21701
372,181572,"Little black specks stuck onto side of house, house hand railing, vehicles in driveway and the property.  Complainant stated specks of hard oil.",['Air'],2023-10-03,2023-09-29,Anne Arundel,2023-10-02,Incident Closed-Managed,21060
373,181571,"Black smoke coming out of rooftop at Supreme Repair.  Concern of burning tires, ether, ground contamination from storage of chemicals,  55 gallon drums, storm water pollution runoff issues, storage of many scrap tires.  Possible zoning issues too.  Complainant concerned about facility retaliation towards him.",['Air'],2023-10-03,2023-09-29,Anne Arundel,,Under Investigation,21054
374,181567,Odors in Balto and Harford Counties,['Odor'],2023-10-01,,Baltimore,2023-10-03,Incident Closed-Managed,
375,181566,"Neighboring house is vacant and in poor condition. Air quality concerns include asbestos, lead, and rodent activity.","['Air', 'Asbestos Complaint']",2023-10-02,2023-10-02,Montgomery,,Referred to Outside Agency,
376,181554,Dust from sand blasting vehicles,['Air'],2023-09-27,2023-09-27,Frederick,,Clean-up Initiated,
377,181551,Dust from sand blasting of vehicles,['Air'],2023-09-26,2023-09-25,Frederick,,Clean-up In Progress,
378,181546,permitting inquiry regarding  bio charge process,['Other'],2023-09-25,2023-09-18,Howard,2023-09-25,Incident Closed-Managed,
379,181544,Lead Issue,['Other'],2023-09-15,2023-09-15,Allegany,2023-09-22,Incident Closed - No further action,
381,181532,"Students and staff at Poolesville High School have been exposed to toxic fumes from construction for one month at least from February 14, 2023 to March 14, 2023.","['Air', 'Fumes', 'Odor']",2023-09-21,2023-03-22,Montgomery,2023-09-21,Incident Closed-Managed,20837
382,181531,Complainant states acid is being sprayed into the AC system inside the Walmart Store.,['Air'],2023-09-21,2023-09-21,Charles,,Incident Not Applicable to MDE,
383,181530,Septic system odor in neighborhood usually detected in the morning.,['Air'],2023-09-21,2023-09-19,Frederick,2023-09-21,Incident Closed-No Violation Observed,
384,181529,"Fumes, odor, overspray from spray painting vehicles.  Complainant has contacted AA County Zoning Dept.  and stated that Zoning has issued a Violation Notice.",['Air'],2023-09-21,2023-09-19,Anne Arundel,2023-11-21,Incident Closed - No further action,21054
385,181528,Dust from sand blasting of vehicles,['Air'],2023-09-21,2023-09-18,Frederick,,Clean-up Initiated,
386,181526,Dust from business next door,['Fugitive Dust/Particulate Matter'],2023-09-18,,Baltimore,2023-09-28,Incident Closed - No further action,21162
387,181525,Burning - smoke,['Smoke'],2023-09-18,,Harford,2023-09-19,Incident Closed-Managed,
388,181517,Dust from sand blasting of vehicles,['Air'],2023-09-18,2023-09-12,Frederick,,Clean-up In Progress,
389,181516,Smoke burning leaves in neighbor's yard.,['Air'],2023-09-18,2023-09-06,Anne Arundel,2023-09-18,Incident Closed - No further action,
390,181515,Seafood odor.  Refrigerated truck used for storage and transport of crabs.  Commercial business located in residential neighborhood.,['Air'],2023-09-18,2023-09-05,Anne Arundel,,Under Investigation,
391,181514,Neighbor maintains pigs and severe odors are present. Child has vomited from pig odors.,['Odor'],2023-09-14,2023-09-14,Carroll,,Referred to Outside Agency,
392,181512,Stream Bank Erosion,['Non-Tidal Wetlands/Waterway'],2023-09-12,2023-09-12,Washington,,Referred to WMA,
394,181491,Odor Complaint,['Odor'],2023-09-08,2023-09-08,Dorchester,2023-09-08,Incident Closed - No further action,21835
395,181490,Odor Complaint,['Odor'],2023-09-08,2023-09-08,Dorchester,2023-09-08,Incident Closed - No further action,21835
396,181489,Odor Complaint,['Odor'],2023-09-08,2023-09-08,Dorchester,2023-09-08,Incident Closed - No further action,21835
397,181488,Odor Complaint,['Odor'],2023-09-08,2023-09-08,Dorchester,2023-09-08,Incident Closed - No further action,21835
398,181487,Odor Complaint,['Odor'],2023-08-29,2023-08-29,Dorchester,2023-09-29,Incident Closed - No further action,21835
399,181483,Concern of deceased body in the area,['Other'],2023-09-11,2023-09-11,Washington,2023-09-11,Incident Closed-Managed,
400,181482,boom noise of explosion in the Cheverly area,['Other'],2023-09-11,2023-09-10,Prince George's,2023-09-15,Incident Closed-Managed,
401,181480,Smoke coming from stack.,['Smoke'],2023-09-11,,Baltimore,2023-09-20,Incident Closed - No further action,21228
402,181479,There is a smell like burning wire in the air.,['Odor'],2023-09-08,,Baltimore,2023-09-11,Incident Closed-Managed,
403,181478,Dust from construction.,['Fugitive Dust/Particulate Matter'],2023-09-08,,Baltimore,2023-09-11,Incident Closed-No Violation Observed,
404,181462,Burning,['Fumes'],2023-09-05,,Harford,2023-09-07,Incident Closed-Managed,
405,181459,He smells an industrial odor in the residential neighborhood.,['Odor'],2023-09-01,2023-09-01,Baltimore City,2023-09-05,Incident Closed-Managed,
406,181458,He smells an industrial odor in the residential neighborhood.,['Odor'],2023-08-28,2023-08-28,Baltimore City,2023-09-05,Incident Closed-Managed,
407,181457,He smells an industrial odor in the residential neighborhood.,['Odor'],2023-08-23,2023-08-23,Baltimore City,2023-09-05,Incident Closed-Managed,
408,181456,He smells a burning odor in the air at his business.,['Odor'],2023-08-23,2023-08-23,Baltimore City,2023-09-05,Incident Closed-Managed,
409,181455,He smells an industrial odor in the residential neighborhood.,['Odor'],2023-08-17,2023-08-17,Baltimore City,2023-09-05,Incident Closed-Managed,
410,181454,He smells an industrial odor in the residential neighborhood.,['Odor'],2023-08-14,2023-08-14,Baltimore City,2023-09-05,Incident Closed-Managed,
411,181453,He smells an industrial odor in the residential neighborhood.,['Odor'],2023-07-24,2023-07-24,Baltimore City,2023-09-05,Incident Closed-Managed,
412,181452,She smells chemicals in her apartment.,['ARA AQCP non-regulated entity'],2023-07-21,2023-07-21,Baltimore City,2023-09-05,Incident Closed - No further action,
413,181451,He smells an industrial odor in the residential neighborhood.,['Odor'],2023-07-20,2023-07-20,Baltimore City,2023-09-05,Incident Closed-Managed,
414,181442,Loud noise from Cheverly Metro station,['Other'],2023-08-30,2023-08-30,Prince George's,2023-09-15,Incident Closed-Managed,
415,181440,Loud noise from Cheverly metro station.,['Other'],2023-08-30,2023-08-30,Prince George's,2023-09-15,Incident Closed-Managed,
416,181427,concern of noise and emission from Northwestern High school,['Other'],2023-08-28,2023-08-28,Prince George's,2023-08-30,Incident Closed-Managed,20782
417,181426,Boom noise in the Cheverly area,['Other'],2023-08-25,2023-08-25,Prince George's,2023-08-30,Incident Closed-Managed,
418,181425,painting without a paint booth,['Other'],2023-08-18,2023-08-18,Prince George's,2023-08-18,Incident Closed-Managed,
419,181424,Strong smell of oil odor in the Cheverly area,['Other'],2023-08-17,2023-08-17,Prince George's,2023-08-30,Incident Closed-Managed,
420,181422,Dust from sand blasting crossing property line and getting on his personal vehicles by his house.,['Air'],2023-08-29,2023-08-29,Frederick,2023-08-29,Incident Closed-Managed,
421,181421,Dust from sandblasting going into neighbor's yard and on his vehicles.,['Air'],2023-08-29,2023-08-28,Frederick,2023-08-29,Incident Closed-Managed,
422,181420,Paint fumes/odor from recent paint application at the school.  Unable to clearly hear the name of the school.  No phone number given.,['Air'],2023-08-29,2023-08-28,Anne Arundel,2023-08-29,Incident Closed - No further action,
423,181419,"Poor air quality, chemical odor in her neighborhood.  She hears a machine that may be creating the odor.",['Air'],2023-08-29,2023-08-28,Charles,,Under Investigation,
424,181418,Digging Up a Stream,['Other'],2023-08-28,2023-08-28,Frederick,,Referred to WMA,21788
425,181416,Odor Complaint,['Odor'],2023-08-22,2023-08-22,Dorchester,2023-08-22,Incident Closed - No further action,21835
426,181412,Dust issue from quarry,['Other'],2023-08-17,2023-08-17,Howard,2023-08-28,Incident Closed-Managed,20794
427,181403,Neighbor is burning trash.,['Open Burning'],2023-08-21,,Harford,2023-08-22,Incident Closed-Managed,
428,181391,Exterior Radio frequency waves in the air are causing noises from the wall in her house.,['Noise Complaint'],2023-08-17,2023-08-16,Anne Arundel,,Incident Not Applicable to MDE,
429,181379,Concern of smoke of Cigarette and Marijuana,['Other'],2023-08-10,2023-08-10,Prince George's,2023-08-14,Incident Closed-Managed,
430,181376,Odor from holding tank.,['Odor'],2023-08-14,2023-08-14,Dorchester,,Referred to WMA,21643
431,181375,Dust and Smoke,"['Fugitive Dust/Particulate Matter', 'Smoke']",2023-08-11,2023-08-11,Washington,,Under Investigation,21740
432,181372,Odor Complaint,['Odor'],2023-08-10,2023-08-10,Anne Arundel,2023-08-10,Incident Closed - No further action,
433,181371,Complainant described strong odor emanating from Petroleum Management. Employees from nearby business complain of burning of their eyes. Complainant also said PMI was dumping liquids into the sewer.,['Odor'],2023-08-11,2023-08-09,Baltimore City,2023-08-14,Incident Closed - No further action,
434,181365,Odors from a holding tank.,['Odor'],2023-08-07,2023-08-05,Dorchester,2023-08-08,Incident Closed-No Violation Observed,21643
436,181348,Abandoned Gas Well,['Other'],2023-08-02,2023-08-02,Garrett,2023-08-08,Incident Closed - No further action,21550
438,181327,Odors from a holding tank.,['Odor'],2023-07-31,2023-07-31,Dorchester,2023-07-31,Incident Closed - No further action,21643
439,181314,Smoke from burning at a sawmill.,['Air'],2023-07-27,2023-07-27,Charles,,Under Investigation,
440,181313,Odor,['Odor'],2023-07-26,,Baltimore,2023-07-27,Incident Closed - No further action,
441,181311,Dust and Air Quality Concerns,['Fugitive Dust/Particulate Matter'],2023-07-24,2023-07-24,Washington,,Under Investigation,21740
442,181307,Unknown odor,['Odor'],2023-07-26,,Baltimore,2023-07-27,Incident Closed - No further action,
443,181304,He smells an industrial odor in the residential neighborhood.,['Odor'],2023-07-15,2023-07-15,Baltimore City,2023-07-25,Incident Closed-Managed,
444,181303,That a BGE contractor left behind excessive fugitive dust in front of her home.,['Fugitive Dust/Particulate Matter'],2023-07-13,2023-07-13,Baltimore City,2023-07-25,Incident Closed-Managed,
445,181302,He smells an industrial odor in the residential neighborhood.,['Odor'],2023-07-09,2023-07-09,Baltimore City,2023-07-25,Incident Closed-Managed,
446,181301,He smells an industrial odor in the residential neighborhood.,['Odor'],2023-07-07,2023-07-07,Baltimore City,2023-07-25,Incident Closed-Managed,
447,181300,He smells an industrial odor in the residential neighborhood.,['Odor'],2023-07-06,2023-07-06,Baltimore City,2023-07-25,Incident Closed-Managed,
448,181297,He smells an industrial odor in the residential neighborhood.,['Odor'],2023-06-26,2023-06-26,Baltimore City,2023-07-25,Incident Closed-Managed,
449,181296,He wants someone to test indoor air quality.,['Air'],2023-06-24,2023-06-24,Baltimore City,2023-07-25,Incident Closed - No further action,
450,181295,He smells an industrial odor in the residential neighborhood.,['Odor'],2023-06-22,2023-06-22,Baltimore City,2023-07-25,Incident Closed-Managed,
451,181294,He smells an industrial odor in the residential neighborhood.,['Odor'],2023-06-16,2023-06-16,Baltimore City,2023-07-25,Incident Closed-Managed,
452,181293,He smells an industrial odor in the residential neighborhood.,['Odor'],2023-07-12,2023-06-12,Baltimore City,2023-07-25,Incident Closed-Managed,
453,181292,"Power washed her home, now concerned about silica dust that was created.",['Fugitive Dust/Particulate Matter'],2023-06-06,2023-06-06,Baltimore City,2023-07-25,Incident Closed - No further action,
454,181291,He smells an industrial odor in the residential neighborhood.,['Odor'],2023-06-05,2023-06-05,Baltimore City,2023-07-25,Incident Closed-Managed,
455,181290,He smells an industrial odor in the residential neighborhood.,['Odor'],2023-06-02,2023-06-02,Baltimore City,2023-07-25,Incident Closed-Managed,
456,181289,Smoke from neighbor burning,['Smoke'],2023-07-24,,Harford,2023-07-31,Incident Closed-Managed,
457,181284,Severe overspray coming from exhaust of Airpark Auto Center vehicle paint spray booth.,['Air'],2023-07-17,2022-11-30,Montgomery,,Under Investigation,20879
458,181283,Air quality concerns regarding Purple Line construction.,"['Air', 'Fugitive Dust/Particulate Matter', 'Odor']",2023-07-14,2023-07-14,Montgomery,,Referred to Outside Agency,
459,181278,Burning on Pavement,"['Odor', 'Open Burning', 'Smoke']",2023-07-11,2023-07-10,Allegany,2023-07-21,Incident Closed-Managed,21501
460,171278,Dust from Grable's Commercial sandblasting & spray painting.,['Air'],2023-07-20,2023-07-20,Frederick,,Under Investigation,
461,171263,Burning Plastics,"['Odor', 'Open Burning', 'Smoke']",2023-07-06,2023-06-28,Garrett,2024-01-31,Incident Closed - No further action,21550
462,171261,BurningTires,"['Odor', 'Open Burning', 'Smoke']",2023-07-06,2023-06-16,Garrett,2024-01-31,Incident Closed - No further action,21531
463,171257,Dust from sandblasting and overspray of commercial vehicles and parts.,['Air'],2023-07-17,2023-07-17,Frederick,,Under Investigation,21757
464,171251,Formaldehyde type of odor in new apartment.  Would like indoor air test.  The County was not provided in original message.,['Air'],2023-07-13,2023-07-13,Prince George's,2023-07-13,Incident Closed-No Violation Observed,
465,171247,Smoke and odor from open burning,['Open Burning'],2023-07-03,2023-07-03,Wicomico,2023-07-06,Incident Closed-No Violation Observed,21804
466,171235,concern of odor from American Paving Fabrics,['Other'],2023-07-06,2023-07-06,Howard,2023-07-10,Incident Closed-Managed,
467,171234,Smoke from neighbor's firepit smoldering.,['Air'],2023-07-10,2023-07-06,Anne Arundel,2023-07-17,Incident Closed-Managed,21054
468,171233,Smoke from burning furniture in their yard.,['Air'],2023-07-10,2023-07-05,Anne Arundel,2023-07-17,Incident Closed-Managed,21122
469,171232,Odor from dumpster at building construction site.,['Air'],2023-07-10,2023-07-03,Anne Arundel,2023-07-14,Incident Closed-Clean-up Completed,21401
470,171231,Spray painting without a spray booth.  FY23-275851-3714-CV,['Air'],2023-07-10,2023-07-06,Frederick,2023-07-14,Incident Closed-No Violation Observed,21770
471,171223,Concern of Freon/Ac,['Other'],2023-07-05,2023-07-05,Prince George's,2023-07-07,Incident Closed-Managed,
472,171218,Inquiry of air quality forecast,['Other'],2023-06-29,2023-06-29,Howard,2023-07-05,Incident Closed-Managed,
473,171217,concern of Freon /AC,['Other'],2023-06-28,2023-06-28,Prince George's,2023-07-05,Incident Closed-Managed,
474,171212,Haze and air quality index high. Canadian wildfires.,['Air'],2023-06-30,2023-06-29,Anne Arundel,2023-06-30,Incident Closed - No further action,
475,171211,Concern over the fire department's house burn for training.,['Smoke'],2023-06-29,,Harford,2023-06-30,Incident Closed - No further action,
476,171210,Severe odors occurring from liquid manure/ sludge application at agricultural field in Westminster.,"['Air', 'Odor']",2023-06-29,2023-06-29,Carroll,,Referred to Outside Agency,21158
477,171206,Indoor air of complainant's apartment has odors.,['Odor'],2023-06-27,,Baltimore,,Incident Not Applicable to MDE,
479,171195,"Concerns regarding unknown indoor environmental factors inside home causing sores and ""electric"" feeling.",['Air'],2023-06-28,2023-06-28,Baltimore,2023-06-28,Incident Closed - No further action,
480,171188,Fumes from racetrack,['Fumes'],2023-06-26,,Harford,2023-06-29,Incident Closed-Managed,
481,171187,100% opacity of black smoke from crematory stack.  Video submitted.,['Air'],2023-06-27,2023-06-27,Charles,,Under Investigation,
483,171155,Dust from sandblasting of commercial vehicles.,['Air'],2023-06-23,2023-06-23,Frederick,,Under Investigation,
484,161146,Dust and straw from county stabilization project.,['Fugitive Dust/Particulate Matter'],2023-06-21,,Baltimore,2023-06-21,Incident Closed - No further action,
485,161144,Dust from sandblasting vehicles.,['Air'],2023-06-21,2023-06-20,Frederick,,Under Investigation,
486,161143,Dust from sand blasting.  Video submitted,['Air'],2023-06-21,2023-06-19,Frederick,,Under Investigation,
487,161141,Odors from WWTP,['Odor'],2023-06-20,2023-06-15,Washington,,Referred to WMA,21782
488,161135,Complainant believes that York Building Products Principio Quarry is responsible for sand and dust concerns at Chesapeake House Travel Plaza.,"['Air', 'Fugitive Dust/Particulate Matter']",2023-06-06,2023-05-22,Cecil,2023-06-15,Incident Closed-Managed,21904
489,161134,"Degreaser overspray and oil dumped onto land from the Fleet Maintenance Brothers business.  Business is a junkyard for vehicles & vehicle & tractor trailer repairs. 
 Complainant lives next door.  Complainant would like to know if degreasers are more hazardous than  ETO's as discussed in their community meeting.",['Air'],2023-06-15,2023-06-13,Anne Arundel,2023-06-16,Incident Closed-Managed,20794
490,161132,Neighboring property is an illegal salvage yard. Consistent open burning of materials is occurring at this site. Cecil County government is not addressing the concerns.,['Open Burning'],2023-06-12,2023-06-12,Cecil,,Referred to Outside Agency,21921
491,161130,Dust from Chesapeake Monuments,['Fugitive Dust/Particulate Matter'],2023-06-14,,Baltimore,2023-06-23,Incident Closed-No Violation Observed,
492,161125,Dust from company making monuments.,['Fugitive Dust/Particulate Matter'],2023-06-14,,Baltimore,2023-06-23,Incident Closed-No Violation Observed,
493,161116,"Neighbors are open burning in a fire pit, also have outside grill.",['Open Burning'],2023-06-05,2023-06-05,Carroll,,Referred to Outside Agency,21771
494,161115,Dust from sandblasting at Grable's Commercial Sandblasting & Spray painting business crossing property line  to neighbor's house and vehicle.,['Air'],2023-06-12,2023-06-12,Frederick,,Under Investigation,
495,161112,Concern of fumes from a commercial building painting cars,['Other'],2023-06-07,2023-06-07,Howard,2023-08-07,Incident Closed-Managed,
496,161111,concern of sticky substance falling from the sky.,['Other'],2023-06-06,2023-06-06,Howard,2023-06-12,Incident Closed-Managed,
497,161106,Dust on Road,['Fugitive Dust/Particulate Matter'],2023-06-02,2023-06-02,Allegany,2024-01-31,Incident Closed - No further action,
498,161105,Neighboring farm is spreading manure.,['Odor'],2023-06-09,,Harford,,Referred to Outside Agency,
499,161104,Employees standing outside in bad air quality.,['Air'],2023-06-08,,Harford,2023-06-09,Incident Closed-Managed,
500,161102,"Open burning of trees, building materials/refuse.",['Open Burning'],2023-06-06,2023-06-06,Wicomico,2023-06-06,Incident Closed-No Violation Observed,21801
501,161102,"Open burning of trees, building materials/refuse.",['Open Burning'],2023-06-06,2023-06-06,Wicomico,2023-06-06,Incident Closed-No Violation Observed,21822
502,161101,Paint chips on property from prepping water tower to be painted.,['Fugitive Dust/Particulate Matter'],2023-06-07,2023-06-07,Dorchester,2023-06-08,Incident Closed-Managed,21664
503,161093,Dust from sand blasting and overspray from spray painting.  Dust crosses property line.,['Air'],2023-06-08,2023-06-07,Frederick,,Under Investigation,
504,161092,Sticky substance on her car windshield.,['Air'],2023-06-08,2023-06-05,Frederick,2023-06-08,Incident Closed - No further action,
505,161089,Dust At Concrete Plant,['Fugitive Dust/Particulate Matter'],2023-05-19,2023-05-10,Washington,2024-03-19,Incident Closed-No Violation Observed,21740
506,161086,Garbage in Stream,['Non-Tidal Wetlands/Waterway'],2023-05-17,2023-05-17,Allegany,2023-06-08,Incident Closed - No further action,21539
507,161081,He smells an industrial odor in the residential neighborhood.,['Odor'],2023-06-01,2023-06-01,Baltimore City,2023-06-07,Incident Closed-Managed,
508,161080,He smells an industrial odor in the residential neighborhood.,['Odor'],2023-05-31,2023-05-31,Baltimore City,2023-06-07,Incident Closed-Managed,
509,161079,He smells an industrial odor in the residential neighborhood.,['Odor'],2023-05-29,2023-05-29,Baltimore City,2023-06-07,Incident Closed-Managed,
510,161078,He smells an industrial odor in the residential neighborhood.,['Odor'],2023-05-28,2023-05-28,Baltimore City,2023-06-07,Incident Closed-Managed,
511,161077,He smells an industrial odor in the residential neighborhood.,['Odor'],2023-05-27,2023-05-27,Baltimore City,2023-06-07,Incident Closed-Managed,
512,161076,He smells an industrial odor in the residential neighborhood.,['Odor'],2023-05-24,2023-05-24,Baltimore City,2023-06-07,Incident Closed-Managed,
513,161075,He smells an industrial odor in the residential neighborhood.,['Odor'],2023-05-19,2023-05-19,Baltimore City,2023-06-07,Incident Closed-Managed,
514,161074,He smells an industrial odor in the residential neighborhood.,['Odor'],2023-05-18,2023-05-18,Baltimore City,2023-06-07,Incident Closed-Managed,
515,161073,Dust created by power washing.,['Fugitive Dust/Particulate Matter'],2023-05-17,2023-05-17,Baltimore City,2023-06-07,Incident Closed-Managed,
516,161072,Street covered in white substance.,['Fugitive Dust/Particulate Matter'],2023-05-16,2023-05-16,Baltimore City,2023-06-07,Incident Closed-Managed,
517,161071,He smells an industrial odor in the residential neighborhood.,['Odor'],2023-05-10,2023-05-10,Baltimore City,2023-06-07,Incident Closed-Managed,
