,sno,complaint,complaint_description,complaint_type,recieved_date,incident_date,county,incident_status_desc,incident_zip,incident_closed_date
127,128,222068,concern of air pollution from private contractor,['Other'],2024-02-05,2024-02-05,Not Yet Determined,Incident Closed-Managed,,2024-02-05
357,358,181543,Odor inside apartment.,['Air'],2023-09-22,2023-09-21,Not Yet Determined,Incident Not Applicable to MDE,,
370,371,181510,Unknown,['Other'],2023-09-08,2023-09-08,Not Yet Determined,Incident Closed - No further action,,2023-09-22
412,413,181349,Lead,['Other'],2023-08-07,2023-08-07,Not Yet Determined,Incident Closed - No further action,,2023-08-08
414,415,181343,testing of fugitive matter from AC,['Other'],2023-08-07,2023-08-07,Not Yet Determined,Incident Closed-Managed,,2023-08-07
455,456,171205,Concerned with general poor ambient air quality in Maryland and would like to know what actions are being taken to improve air quality.,['Air'],2023-06-28,2023-06-28,Statewide,Incident Closed-Managed,,2023-06-29
459,460,171180,Automobile shop operating without machine.,['Other'],2023-06-26,2023-06-26,Not Yet Determined,Incident Closed-Managed,,2023-07-07
634,635,140705,Freon Release,['Air'],2023-03-28,2023-03-28,Not Yet Determined,Referred to Outside Agency,,
